260392650,Chaque maison a son histoire : guide des sources relatives au patrimoine immobilier privé,"Ce livre abondamment illustré invite le lecteur à un parcours à travers les différents types de sources permettant de retracer l'évolution d'un bien immobilier privé, de sa conception, de son environnement, de ses affectations et de ses occupants successifs	Architecture domestique -- Histoire -- Sources;Propriété immobilière -- Histoire -- Sources	900
260392707	Une idée par jour pour un management efficace et conscient	Entreprendre est une expérience de développement personnel qui crée de la valeur pour les porteu.r.se.s de projets, les dirigeant.e.s et la société en général. Au-delà des techniques de management, des attitudes, des comportements et des responsabilités, il demeure un domaine largement inexploré : celui des états d'âme et de la recherche de l'accomplissement individuel et collectif. Cet almanach (un conseil par jour) invite, en peu de temps, à se laisser surprendre et à apprendre au quotidien. La classification par thèmes permet également de retrouver d'autres réflexions semblables ou connexes à notre intérêt du moment. Établissant des liens entre les états d'âme, les techniques de gestion, les courants de pensée et les sagesses ancestrales, l'auteur a réussi à condenser son expérience du terrain, ses recherches et ce qu'il a pu percevoir. Ce livre nous donne les clés essentielles dans la gestion et l'exploitation de nos ressentis de dirigeant.e.s. C'est également une initiation à la gouvernance, ses concepts et ses modes de réflexion. Il s'adresse aussi à ceux qui hésitent à choisir un ouvrage de management. Il fournit un large éventail de références qui peuvent orienter les prochaines lectures. Vous y trouverez des réponses, des questions, des outils et une foule de références exprimées en peu de mots.	Efficacité de l'organisation;Gestion d'entreprise;Psychologie du travail	
260392960	Urbanisme, entre utopies et monde d'après""","Toute l'histoire de l'urbanisme est indissociable de l'utopie. Le mal logement, les conditions de vie déplorables des ouvriers, leurs aspirations à un mieux vivre, leur considération croissante par des patrons avant-gardistes, les luttes syndicales, ont conduit à des opérations exemplaires. Cités-jardins, cités Castors, palais fouriéristes, l'utopie est fondatrice et le Familistère de Guise est le lieu de la concrétisation de cette cité idéale. Les crises sociétales et sanitaires récentes ont remis en cause la pensée progressiste et moderniste. L'envie d'un monde meilleur, plus égalitaire, plus coopératif, plus apaisé, mais aussi plus frugal et moins consumériste, fait son chemin et rejoint, sur beaucoup de points, les idées fondatrices des utopistes. Rêver d'un monde meilleur, c'est penser une autre ville. Parler d'un « monde d'après » c'est déjà affirmer qu'on désire le construire. Cet ouvrage retrace l'histoire de l'utopie en urbanisme, analyse les enjeux éco sociologiques qui se posent à nous clairement et jette les bases d'un nouvel urbanisme de « l'après »",Imagination;Réalité;Urbanisme;Utopies;Villes,,,,,,
264616812,Essai sur la méthodologie de la production normative et scientifique en Afrique subsaharienne : l'exemple de la production du droit et de la science du droit,La prévalence formelle du droit d'inspiration étrangère ou droit moderne comme droit applicable dans l'environnement africain subsaharien sur ,"e droit coutumier local a abouti à un certain pluralisme, une compétition entre les deux catégories de droit, ",, existe dans ce sens une difficulté pour le droit moderne de s'imposer et d'être appliqué avec effectivité qui a provoqué ,"a rémanence du droit coutumier local sous la forme d'un droit informel. Après une étude des liens entre l'usage des méthodes d'élaboration du droit ainsi que celles de la science du droit de chaque catégorie de système (traditionnel et moderne) des sociétés d'Afrique subsaharienne et le droit informel (forme rémanente du droit coutumier local) qui s'est manifesté et s'est développé, il serait possible de faire une observation. Celle-ci permet de relever que pour remédier à cette distance entre le droit applicable et le droit réellement appliqué qui constitue un obstacle à l'efficacité des politiques dans plusieurs domaines, le recours à une alternative méthodologique du droit et de sa science adaptée à l'environnement local se présente actuellement comme tout à fait nécessaire. Les éléments qui permettent de l'attester, selon la présente étude, sont relatifs au fait que ","a marginalisation d'une option méthodologique originelle ou fondamentale en matière de droit et de science du droit qui aurait pu éviter le développement considérable d'un droit informel, laisse clairement apparaitre l'impuissance ou la défaillance de l'orientation méthodologique actuelle via-à-vis de ",a persistance du droit informel.,Hiérarchie des normes juridiques,
266610676,Doré : recontextualiser l'attrait de l'or : von neuen Allianzen und Verschmelzungen : a matter of allure,"Ist die wiederkehrende Hinwendung zu einem traditionsaufgeladenen Material in der zeitgenössischen Kunst der Versuch, das Edelmetall vom historischen Erbe, von Prunk und Pathos zu befreien? Wird damit die Aussage „es ist nicht alles Gold, was glänzt“ überprüft, indem der stets begehrte und glänzende Werkstoff in andere Zusammenhänge übertragen oder verschoben wird? Die von Harald F. Theiss kuratierte Ausstellung DORÉ ", VERGOLDET ," GILDED und der begleitende Katalog vereinen Werke der zeitgenössischen Kunst, die  sich mit dem Werk- und Farbstoff Gold auseinandersetzen und reflektieren die damit verknüpften Vorstellungen von Wert und Symbolkraft.","Art -- Thèmes, motifs;Or -- Dans l'art",704.94955341,,,,
267659466,Principes de marketing,"Accessible et ancrée dans son époque, une initiation à 360° aux concepts clés et pratiques du marketing par les deux plus grands experts mondiaux pour une meilleure compréhension des stratégies en marketing. Dans cette nouvelle édition, vous découvrirez : Les mutations profondes du marketing vers toujours plus d'éthique, de responsabilité sociétale et écologique : marketing durable, économie circulaire, vente en vrac, dénonciation du suremballage, production locale... ; La digitalisation de la société et les innovations technologiques en marketing. ; Des données et études de cas mises à jour et enrichies par une nouvelle équipe d'auteurs. ; Un décryptage des tendances actuelles et des nouvelles attentes à l'égard du marketing : Potterheads, K-pop, biscuits Nutella, marché des jeux vidéo, réalité augmentée, évolutions liées au genre, kidadultes ; marques engagées : C'est qui le Patron ? ! , Dove, VEJA ; santé connectée et innovations post-pandémie. ; Des ressources sur la plateforme d'enseignement- apprentissage MyLab "," version française : apprendre, s'entraîner, mémoriser les concepts clés et réviser à son rythme et en parfaite autonomie",Marketing,658.8,,,,,
268071004,"Arduino Pas à pas  :  Le guide ultime du débutant avec les bases du matériel, du logiciel, de la programmation et des projets ", Arduino ," Pas à pas, est le livre pour tous ceux qui veulent apprendre les bases du mini-PC Arduino par un ingénieur (M.Eng.). Dans ce livre, vous apprendrez à la fois les bases théoriques et l'utilisation pratique d'un Arduino à l'aide de superbes exemples pratiques (comme par exemple : Signal SOS avec LED, contrôle LED basé sur la température, contrôle d'un moteur en fonction de la lumière, et plus encore). Ce livre est le tout-en-un pour les débutants, car il explique en détail toutes les bases nécessaires à l'utilisation d'un Arduino en termes de matériel, de logiciel et de programmation. D'ailleurs, dans ce livre, nous travaillerons exclusivement avec l'Arduino Uno, car il est parfaitement adapté aux débutants. L'objectif de ce livre est de vous faire comprendre ce qu'est un Arduino, comment il fonctionne et comment l'utiliser pour de superbes projets. C'est un livre qui vous permet de comprendre les bases de l'électrotechnique, de la programmation et de la construction de circuits pour Arduino. Jetez-y un coup d'œil dès maintenant et recevez votre exemplaire chez vous, en livre électronique ou en livre de poche !",Informatique -- Internet;Programmation sur Internet;Électronique,,,,,,
